carrefour-es;la despensa dulce y desayuno siropes aromas y decoracion;Aroma de vainilla Dr. Oetker 1 ud.;2.05;24.4;g
dia-es;bebidas refrescos te;DIA refresco de té al limón lata 33 cl;0.27;0.82;cl
mercadona-es;marisco y pescado marisco;Tallarimis Pescanova;1.95;7.8;kg
carrefour-es;bebe perfumeria e higiene bastoncillos algodon y sueros;Suero fisiológico bebé Carrefour Baby 40 ud.;5.0;0.12;ud
mercadona-es;marisco y pescado pescado fresco;Boquerón limpio;0.9;4.5;kg
carrefour-es;parafarmacia bebe papillas y galletas;Papilla Infantil Blevit Plus Duplo 8 Cereales Bizcocho Naranja 600 gr;8.9;14.83;kg
carrefour-es;la despensa conservas sopas y precocinados conservas de pescado y marisco;Atún en salsa de tomate Carrefour pack de 3 latas de 52 g.;1.55;9.94;kg
mercadona-es;azucar caramelos y chocolate chocolate;Chocolate con leche Valor almendras enteras;2.55;17.0;kg
carrefour-es;perfumeria e higiene cosmetica unas;Esmalte de uñas perfect stay gel shine 212 satin purple Max Factor 1 ud.;8.05;8.05;ud
carrefour-es;perfumeria e higiene cosmetica labios;Barra de labios 24 h Super Stay nº542 Maybelline 1 ud.;8.95;8.95;ud
mercadona-es;bodega cerveza;Cerveza abadía Tongerlo;4.0;3.03;l
dia-es;bebidas sidra sidra;LADRON DE MANZANAS sidra de manzana botella 25 cl;0.95;3.8;ml
carrefour-es;limpieza y hogar cuidado de la ropa detergentes;Detergente líquido Active Clean Skip 50 lavados.;9.3;0.19;ud
dia-es;frescos carne y aves conejo;Medio conejo troceado bandeja (900 gr aprox.);7.19;7.99;g
carrefour-es;mascotas perros pienso para perros;Pienso de pescado y avena para perro Purina Beyond 3Kg;12.95;4.32;kg
carrefour-es;la despensa cestas y lotes perfumeria para regalar;Estuche Anauk Woman: Colonia 100 ml, Loción Corporal 75 ml y Gel de Baño 75 ml ;9.0;9.0;ud
dia-es;perfumeria e higiene afeitado maquinillas y hojas de afeitar;WILKINSON Sword recambio intuition sensitive care blíster 4 uds;11.99;3.0;ud
carrefour-es;limpieza y hogar papeleria marcadores;8 Fluorescentes Bic Surtidos;5.4;0.68;ud
carrefour-es;la despensa conservas sopas y precocinados croquetas y rebozados;San Jacobos 360 g.;0.93;2.58;kg
mercadona-es;maquillaje bases de maquillaje y corrector;Corrector stick Deliplus 02;4.0;80.0;g
carrefour-es;el mercado charcuteria chorizo lomo y otros;Chorizo ibérico ristra Embutidos Nejosa pieza 700 g aprox;6.6;9.43;kg
carrefour-es;la despensa conservas sopas y precocinados conservas de carne;Pechuga de pollo en aceite de girasol y oliva Carrefour pack de 2 unidades de 42 g.;1.55;18.45;kg
carrefour-es;limpieza y hogar papeleria lapices y accesorios;Pack 2 Gomas de Borrar Nata 612 Milan;1.27;0.64;ud
dia-es;bebidas zumos y nectares zumo;DIA zumo piña manzana uva envase 1 lt;0.69;0.69;ml
carrefour-es;el mercado panaderia bolleria y pasteleria panaderia tradicional;Pan media hogaza de centeno 400 g;2.0;5.0;kg
carrefour-es;la despensa aperitivos frutos secos;Pipa tostada aguasal Carrefour bolsa 250 g;1.15;4.6;kg
mercadona-es;charcuteria y quesos aves y jamon cocido;Pechuga de pavo 0% materia grasa Hacendado al corte;1.8;9.0;kg
carrefour-es;perfumeria e higiene bano e higiene corporal geles de bano;Gel de ducha Coco Natural Honey 650 ml.;1.94;0.3;ml
carrefour-es;la despensa dulce y desayuno cafes;Café intenso en cápsulas Carrefour compatible con Nespresso 10 unidades de 5,2 g.;1.81;34.81;kg
carrefour-es;la despensa dulce y desayuno mermeladas membrillos y compotas;Confitura de frambuesa Hero 345 g.;1.96;5.68;kg
carrefour-es;bebidas vinos todos los vinos;Ramon Bilbao Tinto 2017;8.7;8.7;ud
carrefour-es;bebidas vinos todos los vinos;Arabe Dulce;3.99;5.32;l
dia-es;perfumeria e higiene higiene intima tampones;OB tampón digital super caja 32 uds;5.25;0.16;ud
mercadona-es;aceite especias y salsas mayonesa ketchup y mostaza;Allioli Chovi;0.99;5.21;kg
dia-es;desayuno dulces y pan caramelos y chicles caramelos blandos y golosinas;DIA torcidas regaliz negro bolsa 225 gr;0.99;4.4;g
mercadona-es;carne carne congelada;Chuletas de cordero palo o riñonada congeladas;4.51;12.9;kg
carrefour-es;la despensa conservas sopas y precocinados salteados de verdura arroz y paella;Verdura para paella congelada Carrefour 450 g.;0.75;1.67;kg
mercadona-es;cuidado del cabello champu;Champú Detox Deliplus cabello graso;1.95;0.49;ml
mercadona-es;agua y refrescos refresco de cola;Refresco cola Hacendado Zero azúcar;0.5;0.25;l
dia-es;especial navidad dulces navidad panettones y roscones;Mini panettone de chocolate bolsa 100 gr;0.89;8.9;g
carrefour-es;limpieza y hogar ambientadores absorbeolores;Ambientador Flores Blancas 1 ud.;0.5;3.33;kg
dia-es;alimentacion dieteticos tortitas;ECOCESTA tortitas de espelta bio bolsa 108 gr;1.49;13.8;g
mercadona-es;aceite especias y salsas especias;Molinillo sal marina con hierbas Hacendado;1.6;14.55;kg
mercadona-es;postres y yogures gelatina y otros postres;Tocino de cielo Hacendado;1.08;5.4;kg
mercadona-es;maquillaje bases de maquillaje y corrector;Corrector fluido acción global Deliplus 02;4.0;40.0;ml
carrefour-es;la despensa yogures y postres yogures infantiles;Yogur líquido de fresa y plátano Danonino en bolsitas pack de 4 unidades de 70 g.;1.99;7.11;kg
carrefour-es;parafarmacia botiquin mascarillas;Set la vuelta al cole Hello Kitty niña: Gel higienizante manos 100 ml y mascarilla infantil reutilizable 1 ud.;9.5;9.5;ud
mercadona-es;aperitivos patatas fritas y snacks;Patatas fritas al punto de sal Lay's;1.4;6.36;kg
dia-es;desayuno dulces y pan bolleria bizcochos y magdalenas;MARTINEZ sobaos con mantequilla natural bolsa 27 uds 490 gr;3.39;6.92;g
carrefour-es;el mercado charcuteria chorizo lomo y otros;Chorizo de pueblo dulce extra sarta Revilla 250 g.;3.65;14.6;kg
carrefour-es;la despensa conservas sopas y precocinados conservas de pescado y marisco;Chipirones rellenos en aceite de girasol Cabo de Peñas 70 g.;3.8;54.29;kg
dia-es;perfumeria e higiene cuidado corporal cremas cuerpo  body milk;LACTOVIT leche corporal nutritiva piel normal-seca dosificador 400 ml;3.99;9.98;ml
carrefour-es;limpieza y hogar papel y celulosa papel cocina y multiusos;Papel de cocina Mega 3 Foxy 2 rollos.;2.5;1.25;ud
dia-es;charcuteria y quesos curado salchichon y salami;ELPOZO salchichón extra en lonchas sobre 85 gr;1.0;13.33;g
carrefour-es;el mercado panaderia bolleria y pasteleria panaderia tradicional;Hogaza de pan aldeana Hecho aquí Carrefour 600 g;2.2;3.67;kg
carrefour-es;la despensa dulce y desayuno chocolates turrones y bombones;Chocolate negro 85% con stevia sin azúcar añadido Valor sin gluten 100 g.;1.8;18.0;kg
carrefour-es;la despensa yogures y postres yogures desnatados;Yogur desnatado de fresa Danone Vitalinea sin gluten pack de 4 unidades de 135 g.;2.1;3.89;kg
mercadona-es;cacao cafe e infusiones cafe molido y en grano;Café molido mezcla fuerte Hacendado;4.45;4.45;kg
carrefour-es;la despensa yogures y postres yogures infantiles;Petit de sabores Carrefour Kids pack de 6 unidades de 50 g.;0.55;1.83;kg
dia-es;perfumeria e higiene higiene intima tampones;TAMPAX Compak Pearl super tampón caja 18 uds;3.79;0.21;ud
mercadona-es;postres y yogures yogures naturales y sabores;Yogur natural azucarado Danone;1.99;2.07;kg
dia-es;charcuteria y quesos salchichas salchichas;DIA salchichas viena clásica envase 3 x 200 gr;1.69;2.82;g
carrefour-es;parafarmacia botiquin lentillas y sueros;Suero fisiológico Carrefour 30 ud.;3.29;2.19;ml
carrefour-es;la despensa dulce y desayuno galletas;Galletas de barquillo con chocolate Príncipe 146 g.;1.56;10.68;kg
mercadona-es;limpieza y hogar detergente y suavizante ropa;Quitamanchas en seco;2.05;10.25;l
dia-es;charcuteria y quesos salchichas salchichas;CAMPOFRIO salchichas de pavo pack 3 x 170 gr;2.0;3.92;g
carrefour-es;limpieza y hogar ambientadores decorativos;Ambientador de varillas vainilla y magnolia del humalaya Air Wick Botanica 80 ml.;8.35;104.37;l
dia-es;desayuno dulces y pan pan biscotes y pan tostado;DIA biscotes paquete 800 gr;2.19;2.74;g
carrefour-es;la despensa dulce y desayuno galletas;Galletas de chocolate con leche Digestive Carrefour 300 g.;0.82;2.73;kg
dia-es;desayuno dulces y pan galletas rellenas;DIA galletas mini chops choc cream bolsa 100 gr;0.55;5.5;g
mercadona-es;cereales y galletas cereales;Muesli Crunchy Hacendado con frutos secos;1.75;3.5;kg
mercadona-es;cuidado del cabello champu;Champú sólido Delicatesse de Avena Garnier cabello delicado;4.5;7.5;g
dia-es;perfumeria e higiene cuidado manos jabon de manos liquido;BABARIA jabón líquido de manos rosa mosqueta dosificador 500 ml;1.85;3.7;ml
carrefour-es;perfumeria e higiene cabello acondicionadores;Acondicionador hidratación intensa para cabello seco o dañado Tresemme 855 ml.;4.75;0.56;ml
carrefour-es;la despensa cestas y lotes perfumeria para regalar;Cesta metálica Cherrry Blossom: Gel 220 ml, Loción 220 ml, Exfoliante 50 ml, sales 100 g una vela y esponja;13.4;13.4;ud
mercadona-es;aceite especias y salsas aceite vinagre y sal;Aceite de oliva virgen extra Hacendado Gran Selección;3.69;4.92;l
dia-es;perfumeria e higiene higiene bucal enjuagues y antisepticos;ORAL B enjuague bucal pro expert botella 500 ml;4.99;9.98;ml
carrefour-es;bebidas alcoholes todos los alcoholes;Whisky Tennessee Rye Jack Daniel's 70 cl.;24.4;73.94;l
dia-es;desayuno dulces y pan cafe molido natural;SAIMAZA café molido natural paquete 250 gr;2.05;8.2;g
mercadona-es;panaderia y pasteleria picos rosquilletas y picatostes;Picatostes fritos con ajo Hacendado;0.75;7.5;kg
carrefour-es;bebe perfumeria e higiene crema corporal talcos y antiirritacion;Crema corporal aceite de almendra Carrefour Baby 500 ml.;3.03;0.4;ml
carrefour-es;bebidas vinos todos los vinos;Vino D.O Lanzarote Blanco El Afrutado 75 cl.;11.95;11.95;ud
carrefour-es;bebidas vinos tinto;Vino D.O. Utiel-Requena tinto reserva Faustino Rivero pack de 6 botellas de 75 cl.;18.0;18.0;ud
carrefour-es;perfumeria e higiene cabello fijadores;Gel fijador 'Perfec Fix' extra fuerte Giorgi 250 ml.;3.2;1.28;ml
mercadona-es;pizzas y platos preparados pizzas;Rosca sin relleno Hacendado;1.4;4.67;kg
carrefour-es;la despensa conservas sopas y precocinados conservas de pescado y marisco;Sardinas en aceite de oliva Albo 120 g.;1.98;23.29;kg
carrefour-es;mascotas perros premios snacks y huesos;Snack para perros Purina Friskies Funtastix 175 g.;1.9;10.86;kg
carrefour-es;la despensa aperitivos tortitas;Tortitas de maíz sabor jamón ibérico Bicentury 70 g.;1.16;16.57;kg
carrefour-es;bebidas cerveza radler clara;Cerveza Mahou Mixta Shandy con limón pack de 6 botellas de 25 cl.;2.8;1.87;l
mercadona-es;bebe alimentacion infantil;Papilla cóctel tropical +8 meses Hacendado;1.72;3.44;kg
mercadona-es;fruta y verdura fruta;Mandarina;2.18;1.09;kg
carrefour-es;la despensa lacteos bebida vegetal;Bebida de soja sin azúcares Alpro Central Lechera Asturiana brik 1 l.;1.49;1.49;l
carrefour-es;perfumeria e higiene higiene intima incontinencia;Compresas para pérdidas de orina mini Ausonia Discreet 20 ud.;3.6;0.18;ud
carrefour-es;limpieza y hogar bazar herramientas;Paletina canaria para encalar 4';6.6;6600.0;ud
dia-es;alimentacion patatas fritas aperitivos y frutos secos frutos secos;BORGES nuez de california con cáscara bolsa 500 gr;3.29;6.58;g
carrefour-es;perfumeria e higiene bano e higiene corporal colonias;Agua de colonia fragancia original Nenuco Classic 750 ml.;3.6;0.48;ml
carrefour-es;el mercado quesos todos los quesos;Queso brie punta President 200 g;2.95;14.75;kg
carrefour-es;perfumeria e higiene bano e higiene corporal colonias;Agua de colonia fragancia original Nenuco Classic 750 ml.;3.6;0.48;ml
carrefour-es;bebidas cerveza radler clara;Cerveza Cruzcampo Shandy con limón lata 33 cl.;0.65;1.97;l
mercadona-es;aceite especias y salsas otras salsas;Salsa yogur Hacendado;1.2;3.87;l
dia-es;perfumeria e higiene colonias masculinas;BRUMMEL colonia spray 125 ml;7.95;63.6;ml
mercadona-es;cuidado facial y corporal afeitado y cuidado para hombre;Jabón de afeitar en roll-on Lea;1.2;2.4;ml
mercadona-es;cereales y galletas galletas;Galletas tostadas Tosta Rica;1.85;3.25;kg
carrefour-es;mascotas perros pienso para perros;Comida húmeda de pollo y cordero para perro adulto Mini Purina One 4x100 g.;2.3;5.75;kg
carrefour-es;perfumeria e higiene cosmetica rostro;Colorete nº 15 blush Fit Me! Maybelline 1 ud.;8.35;8.35;ud
carrefour-es;mascotas perros pienso para perros;Pienso de buey para perro Medium Maxi Ultima 12 kg.;38.0;3.17;kg
carrefour-es;la despensa dulce y desayuno galletas;Galletas Quelitas Quely 200 g.;1.39;6.95;kg
carrefour-es;el mercado pescaderia pulpo calamar y sepia;Pulpo congelado 1 Kg aprox;10.9;10.9;kg
mercadona-es;panaderia y pasteleria bolleria envasada;Hojaldre relleno de crema Hacendado sin azúcar añadido y sin lactosa;0.17;3.75;kg
carrefour-es;el mercado quesos tierno;Queso de cabra ya cortado García Baquero 250 g;4.6;18.4;kg
mercadona-es;limpieza y hogar utensilios de limpieza y calzado;Cordones marrones calzado sport;1.2;0.6;ud
carrefour-es;perfumeria e higiene cosmetica rostro;Pack tu rutina de cuidad facial Averac: Crema 50 ml, Sérum 30 ml y Booster 10 ml.;10.45;10.45;ud
mercadona-es;congelados tartas y churros;Porras congeladas Hacendado;1.8;7.5;kg
carrefour-es;la despensa conservas sopas y precocinados conservas de vegetales;Guisantes extrafinos Carrefour 230 g.;0.63;2.74;kg
dia-es;congelados y helados platos precocinados base pasta;DIA canelones de carne caja 600 gr;2.19;3.65;g
carrefour-es;la despensa aperitivos snacks;Risketos Risi sin gluten 120 g.;0.94;7.83;kg
dia-es;bebidas refrescos te;DIA refresco de té verde lata 33 cl;0.3;0.91;ml
carrefour-es;perfumeria e higiene cosmetica ojos;Perfilador de ojos líquido nº 002 Brown Velvet Glam'Eyes Rimmel 1 ud.;6.85;6.85;ud
carrefour-es;el mercado panaderia bolleria y pasteleria bolleria tradicional;Croissant de mantequilla Carrefour 8 ud;2.3;0.29;ud
dia-es;perfumeria e higiene botiquin tiritas protectoras;HANSAPLAST tiritas resistentes al agua caja 40 unidades;2.99;0.07;ud
carrefour-es;la despensa lacteos bebida vegetal;Bebida de espelta sin azúcar añadido ecológica Ecocesta brik 1 l.;2.05;2.05;l
carrefour-es;la despensa yogures y postres proteina;Yogur desnatado de arándanos alto en proteínas Danone YoPRO sin gluten pack de 2 unidades de 160 g.;2.05;6.41;kg
mercadona-es;panaderia y pasteleria pan tostado y rallado;Pan tostado pasas Hacendado;1.0;8.33;kg
carrefour-es;bebidas vinos tinto;Vino D.O. Utiel-Requena tinto reserva Faustino Rivero pack de 6 botellas de 75 cl.;18.0;18.0;ud
carrefour-es;el mercado la cocina de carrefour platos de carne y pescado;Migas manchegas 200 g;2.5;2.5;ud
carrefour-es;la despensa aperitivos frutos secos;Almendras crudas sin cáscara sin sal añadida ecológicas Carrefour Bio 90 g.;1.63;18.11;kg
carrefour-es;la despensa alimentacion salsas y tomate frito;Tomate frito Carrefour pack de 3 briks de 390 g.;0.64;0.55;kg
carrefour-es;la despensa conservas sopas y precocinados caldos sopas y pure;Crema de verduras mediterráneas Knorr 500 ml.;2.0;4.0;l
mercadona-es;aperitivos aceitunas y encurtidos;Aceitunas manzanilla sabor anchoa Hacendado con hueso;1.0;4.0;kg
dia-es;alimentacion pastas pasta semi preparada;DIA noodles sabor pollo bolsa bolsa 85 gr;0.49;5.76;g
carrefour-es;bebidas alcoholes vodka;Vodka Eristoff premium black 70 cl.;10.66;15.23;l
carrefour-es;la despensa dulce y desayuno galletas;Galletas de barquillo de chocolate con avellanas Schär sin gluten 105 g.;2.49;23.71;kg
carrefour-es;el mercado quesos todos los quesos;Queso mozzarella Italiana Carrefour 125 g.;0.78;6.24;kg
mercadona-es;arroz legumbres y pasta pasta y fideos;Sémola de arroz Hacendado;0.85;1.7;kg
dia-es;perfumeria e higiene gel de bano sal y espuma de bano;BONTE gel de ducha almendras y miel piel muy seca bote 750 ml;1.49;1.99;ml
carrefour-es;bebidas vinos todos los vinos;Vino D.O. Somontano tinto joven Laus 75 cl.;4.9;4.9;ud
mercadona-es;huevos leche y mantequilla mantequilla y margarina;Mantequilla con sal Hacendado;1.4;5.6;kg
carrefour-es;perfumeria e higiene cabello cepillos peines y accesorios;Cepillo de tinte para el pelo Ponette 1 ud.;1.34;1.34;ud
carrefour-es;limpieza y hogar menaje menaje desechable;Moldes Gold Plumcake  Papel HABI  4 ud 18x7x5 cm;1.99;0.5;ud
mercadona-es;limpieza y hogar pilas y bolsas de basura;Pila recargable AAA-P03 Premio;7.75;1.94;ud
carrefour-es;la despensa alimentacion pastas;Espirales vegetales Carrefour 500 g.;0.59;1.18;kg
carrefour-es;bebe panales y toallitas panales dodot;Pañales Dodot Sensitive T2 (4-8 kg) 234 ud.;42.4;0.18;ud
mercadona-es;carne embutido;Embutido surtido oreado;2.45;6.12;kg
dia-es;charcuteria y quesos curado lomo;LA HOGUERA cabecero de lomo pieza 400 gr;6.29;15.73;g
carrefour-es;perfumeria e higiene bano e higiene corporal desodorantes;Desodorante en spray beauty elixir deomilk Sensitive Nivea 150 ml.;2.85;1.9;ml
carrefour-es;la despensa yogures y postres yogur natural y sabores;Yogur de limón Danone sin gluten pack de 4 unidades de 120 g.;1.09;2.18;kg
mercadona-es;limpieza y hogar papel higienico y celulosa;Papel multiusos resistente Bosque Verde;2.89;2.89;ud
carrefour-es;bebidas aguas y zumos zumos no refrigerados;Zumo de naranja Carrefour con pulpa brik 1 l.;0.99;0.99;l
mercadona-es;limpieza y hogar insecticida y ambientador;Ambientador Glade by Brise lavanda y jazmín;2.46;30.75;g
carrefour-es;bebe alimentacion infantil tarritos y platos preparados;Tarrrito de ternera con judías verdes y zanahorias desde 6 meses Nutribén 235 g.;1.21;5.15;kg
carrefour-es;la despensa dulce y desayuno chocolates turrones y bombones;Turrón imperial de pistacho y cacahuetes Carrefour sin gluten 150 g.;2.13;14.2;kg
carrefour-es;bebidas cerveza todas las cervezas;Cerveza Amstel Oro tostada lata 33 cl.;0.67;2.03;l
dia-es;perfumeria e higiene cuidado facial antiarrugas y antiedad;NIVEA Cellular hyaluron filler crema con color 3 en 1 tono medio 15 gr;19.99;1332.67;ml
dia-es;congelados y helados helados galletas y cucuruchos para helado;MAGNUM helado mini bombón doble caramelo y chocolate caja 6 uds 300 gr;4.69;15.63;g
carrefour-es;el mercado la cocina de carrefour sushi del dia;Crunch cali roll Sushi Daily;7.1;7.1;ud
carrefour-es;limpieza y hogar bazar pequeno electrodomestico;Exprimidor Eléctrico Bluesky BCJ301-16;12.99;12.99;ud
carrefour-es;la despensa dulce y desayuno cafes;Café espresso intenso en cápsulas Nescafé Dolce Gusto 30 unidades de 7 g.;7.86;37.43;kg
carrefour-es;el mercado verduras y hortalizas ensaladas y verduras preparadas;Cebollino fresco cortado Carrefour 20 g;1.15;57.5;kg
carrefour-es;bebidas cerveza rubia;Cerveza Ambar Lager especial pack de 9 latas de 33 cl.;5.75;1.94;l
mercadona-es;cuidado facial y corporal desodorante;Desodorante hombre marine Axe;3.6;2.4;ml
carrefour-es;limpieza y hogar utensilios de limpieza otros utiles;Funda de Escoba Microfibra CARREFOUR;2.4;2.4;ud
mercadona-es;aceite especias y salsas otras salsas;Salsa de tomate, albahaca y orégano Hacendado;0.95;3.17;kg
carrefour-es;limpieza y hogar papeleria pequeno accesorio;Pegamento en Barra Carrefour 4+1 uds;4.3;1.07;ud
mercadona-es;marisco y pescado marisco;Almeja japonesa;7.55;15.1;kg
dia-es;mascotas gatos snacks;AS snack para perros ternera bolsa 12 uds;1.25;10.42;g
carrefour-es;la despensa alimentacion aceites y vinagres;Aceite de oliva virgen extra Dcoop 1 l.;4.95;4.95;l
carrefour-es;perfumeria e higiene bano e higiene corporal perfumeria para regalar;Estuche de belleza Chamoy & Amiguis 1 ud.;15.5;15.5;ud
dia-es;perfumeria e higiene afeitado espuma gel y crema afeitar;LEA espuma de afeitar piel sensible formato viaje spray 100 ml;1.5;15.0;ml
carrefour-es;bebidas alcoholes todos los alcoholes;Vermut Cinzano blanco 1 l.;6.8;6.8;l
carrefour-es;la despensa aperitivos frutos secos;Almendra molida Carrefour tarrina 200 g;2.75;15.71;kg
carrefour-es;limpieza y hogar papeleria lapices y accesorios;2 Estuches Minas HB Bic Leads  0,7 mm;4.99;2.5;ud
carrefour-es;bebidas alcoholes todos los alcoholes;Bebida espirituosa Veterano 1 l.;8.25;8.25;l
carrefour-es;bebidas vinos rosado;Espumoso Pink Moscato Don Luciano 75 cl.;1.95;1.95;ud
carrefour-es;el mercado pescaderia bacalao y salazones;Filetes de bacalao congelados Dimar 400 g.;6.5;18.06;kg
carrefour-es;bebidas refrescos gaseosa;Gaseosa La Casera cero calorías botella 1,5 l.;0.85;0.57;l
carrefour-es;perfumeria e higiene cabello champus;Champú cuidado clásico para cabello normal y mixto Pantene 700 ml.;5.85;0.84;ml
carrefour-es;perfumeria e higiene cuidado y proteccion corporal piel;Aceite de almendra dulce 100% puro ecológico Terre D' Ecologis 100 ml.;11.35;11.35;ml
dia-es;frescos pescado y marisco marisco fresco;ROYAL bacalao ahumado con aceite de oliva envase 110 gr;3.95;35.91;g
carrefour-es;bebidas aguas y zumos zumos no refrigerados;Zumo de 10 frutas y vitaminas Juver sin azúcar añadido brik 2 l.;2.15;1.08;l
carrefour-es;el mercado verduras y hortalizas infusiones mieles y hierbas aromaticas;Miel artesana de eucaliptus monofloral Primo Mendoza 500 g;5.5;11.0;kg
carrefour-es;la despensa dulce y desayuno galletas;Galletas Schär sin gluten 120 g.;2.1;17.5;kg
mercadona-es;aperitivos frutos secos y fruta desecada;Pipas girasol tostadas Hacendado gigante con sal;0.95;4.75;kg
carrefour-es;el mercado quesos otros internacionales;Queso pecorino romano D.O.P. Auricchio Cuña 250 g;5.9;23.6;kg
carrefour-es;perfumeria e higiene higiene intima tampones;Tampones con aplicador regular Tampax caja de 20 uds.;3.6;0.18;ud
dia-es;perfumeria e higiene gel de bano sal y espuma de bano;BONTE gel de baño leche de coco botella 300 ml;1.0;3.33;ml
carrefour-es;perfumeria e higiene bano e higiene corporal jabon de manos;Jabón de manos con aroma a jazmín y limón Palmolive 500 ml.;3.15;6.3;l
mercadona-es;maquillaje bases de maquillaje y corrector;Maquillaje fluido Deliplus perfección satin 03;5.5;18.33;ml
carrefour-es;limpieza y hogar ambientadores decorativos;Ambientador varillas dama de noche Cristalinas 45 ml.;5.15;5.15;ud
mercadona-es;aceite especias y salsas especias;Colorante alimentario Hacendado;1.0;2.86;g
dia-es;desayuno dulces y pan galletas desayuno;LOTUS galleta caramelizada bolsa 120 gr;1.0;8.06;g
dia-es;frescos pescado y marisco pescado fresco blanco;DIA MARI MARINERA gulas clásicas refrigeradas bandeja 200 gr;2.99;14.95;g
carrefour-es;la despensa dulce y desayuno cereales y barritas;Cereales con  futa y nuez Weetabix 450 g.;3.0;6.67;kg
dia-es;frescos pescado y marisco ahumados salazones y marinados;DIA migas de bacalao envase 300 gr;4.89;16.3;g
dia-es;desayuno dulces y pan preparacion de postres decoracion y complementos para postres;DR. OETKER vela cumpleaños nº 7;1.0;1.0;ud
dia-es;drogueria y limpieza limpiadores para el hogar desatascador limpia tuberias;DIRANZO sosa cáustica escamas bote 750 gr;2.15;2.87;g
carrefour-es;la despensa alimentacion salsas y tomate frito;Guacamole Carrefour 200 g;1.59;7.95;kg
dia-es;bebidas vinos tintos castillala mancha;SEÑORIO DE LOS LLANOS vino tinto crianza DO Valdepeñas botella 75 cl;2.6;3.47;ml
carrefour-es;perfumeria e higiene cosmetica labios;Barra de labios infallible 24h nº 213 Toujours Teaberry L'Oréal 1 ud.;14.35;14.35;ud
carrefour-es;la despensa yogures y postres yogures desnatados;Yogur bífidus desnatado con lima y limón Danone Activia pack de 4 unidades de 120 g.;2.09;4.35;kg
dia-es;alimentacion arroz especial integral y semolas;TREVIJANO risotto de hongos bandeja 280 gr;2.49;8.89;g
dia-es;alimentacion dieteticos control de peso;DIA VITAL barritas sustitutivas chocolate negro caja 6 uds 192 gr;4.59;23.91;g
dia-es;perfumeria e higiene cuidado corporal cremas cuerpo  body milk;NIVEA crema corporal triple acción hidratante piel seca botella 400 ml;5.15;12.88;ml
carrefour-es;el mercado panaderia bolleria y pasteleria magdalenas dulces y bollos;Bollito recubierto de chocolate Donettes 7 ud.;1.82;11.97;kg
mercadona-es;arroz legumbres y pasta pasta y fideos;Macarrón al huevo Hacendado;0.99;1.98;kg
carrefour-es;perfumeria e higiene cuidado y proteccion corporal body milk hidratacion bajo la ducha;Crema de hombre para cara, cuerpo y manos Nivea 150 ml.;3.6;2.4;ml
carrefour-es;el mercado charcuteria foie pates y sobrasadas;Paté ibérico Carrefour 125 g.;0.82;6.56;kg
dia-es;mascotas accesorios accesorios;DIXIE collar para perros antiparasitario color negro caja 1 ud;4.29;4.29;ud
carrefour-es;limpieza y hogar cuidado de la ropa aditivos y quitamanchas;Elimina olores textil spray Sanytol 500 ml.;3.95;7.9;l
carrefour-es;bebidas licores y cremas todos los licores y cremas;Crema de orujo Puntemiño 70 cl.;5.69;8.13;l
dia-es;platos preparados pasta y arroz pasta y arroz;AL PUNTO lasaña boloñesa gratinada bandeja 350 gr;2.29;6.54;g
carrefour-es;el mercado panaderia bolleria y pasteleria pan de molde tostado y picos;Preparado para rebozar con ajo y perejil Crunchy Crumbs Esgir sin gluten 100 g.;1.07;10.7;kg
carrefour-es;la despensa conservas sopas y precocinados platos preparados;Fideuá Carretilla pack 2 unidades de 250 g.;3.41;6.82;kg
carrefour-es;la despensa yogures y postres bifidus;Yogur bífidus desnatado con trozos de manzana sin azúcar añadido Carrefour pack de 4 unidades de 125 g.;0.95;1.9;kg
mercadona-es;limpieza y hogar limpieza vajilla;Sal lavavajillas Bosque Verde en pastillas;1.4;0.7;kg
mercadona-es;charcuteria y quesos aves y jamon cocido;Maxi lomo Hacendado finas lonchas;2.08;5.2;kg
dia-es;platos preparados bocadillos y sandwich listos bocadillos y sandwich listos;LA BROCHE Fun roll de pollo y queso 2 unidades bandeja 275 g;1.69;6.15;g
carrefour-es;limpieza y hogar productos para toda la casa limpia muebles;Reparador de madera normal Pronto 100 ml.;4.25;42.5;l
mercadona-es;fruta y verdura verdura;Tomates Anhel;2.8;7.0;kg
carrefour-es;bebidas vinos todos los vinos;Vino D.O. Ribera del Duero tinto fino Finca Resalso 75 cl.;8.5;8.5;ud
