carrefour-es;perfumeria e higiene boca y sonrisa enjuagues bucales;Enjuague bucal Total Care Listerine 500 ml.;5.4;1.08;ml
dia-es;perfumeria e higiene limpieza facial limpieza desmaquilladores;GARNIER Skinactive agua micelar en aceite bote 400 ml;5.35;13.38;ml
carrefour-es;la despensa huevos huevos frescos;Huevos M camperos Quien es el Jefe 12 ud.;2.83;2.83;ud
carrefour-es;la despensa dulce y desayuno dulces y golosinas;Caramelo con palo Piruletas Fiesta 105 g.;1.34;12.76;kg
carrefour-es;la despensa alimentacion aceites y vinagres;Vinagre balsámico de módena Prima 250 ml.;2.5;10.0;l
carrefour-es;parafarmacia bebe potitos;Preparado de pera, plátano, naranja y galleta desde 6 meses Fruta & Go Nutriben bolsita de 90 gr;1.29;14.33;kg
carrefour-es;bebe panales y toallitas panales dodot;Pants Dodot T5 (12-17 kg) 60 ud.;19.99;0.33;ud
dia-es;lacteos y huevos yogures bifidus;DANONE ACTIVIA bífidus natural pack 4 unidades 120 gr;2.09;4.35;g
carrefour-es;el mercado panaderia bolleria y pasteleria pan de molde tostado y picos;Hogaza de cereales The Rustik Bakery 450 g.;2.21;4.91;kg
dia-es;perfumeria e higiene cosmetica quitaesmalte y accesorios;YATP brocha para colorete 1 ud;7.09;7.09;ud
mercadona-es;aperitivos frutos secos y fruta desecada;Cocktail fruta deshidratada Hacendado;1.4;7.0;kg
dia-es;drogueria y limpieza celulosa papel de cocina;REGINA Blitz papel de cocina 3 capas 1 rollo;2.69;2.69;ud
mercadona-es;cuidado facial y corporal higiene intima;Braguita incontinencia talla L Tena lady pants;5.7;1.14;ud
carrefour-es;el mercado verduras y hortalizas infusiones mieles y hierbas aromaticas;Miel de azahar con crema de jengibre y limón Primo Mendoza 280 g;5.95;19.83;kg
dia-es;bebe alimentacion infantil zumos y bebidas;NESTLE manzana y melocotón pouch 90 gr;0.99;11.0;g
carrefour-es;la despensa lacteos bio en lacteos;Leche entera ecológica Carrefour Bio brik 1 l.;0.94;0.94;l
carrefour-es;perfumeria e higiene bano e higiene corporal colonias;Estuche Aire de Sevilla Azahar: colonia 150 ml, crema corporal 150 ml y gel de ducha 150 ml;12.65;12.65;ud
dia-es;charcuteria y quesos salchichas salchichas;ELPOZO salchichas frankfurt envase 160 gr;0.39;2.44;g
carrefour-es;bebidas alcoholes vodka;Vodka Grey Goose 70 cl.;38.8;55.43;l
dia-es;desayuno dulces y pan caramelos y chicles caramelos duros;SOLANO caramelos sabor café expresso bolsa 99 gr;1.99;20.1;g
carrefour-es;bebidas vinos todos los vinos;Vino D.O. Rioja tinto crianza Gran Vendema 75 cl.;4.2;4.2;ud
carrefour-es;bebidas vinos de mesa;Vino blanco semi-dulce Solar de Ricot botella 75 cl.;2.09;2.79;l
dia-es;desayuno dulces y pan chocolates y bombones grajeas y huevos chocolate;LACASA conguitos chocolate con leche y cacahuetes bolsa 220 gr;2.55;11.59;g
carrefour-es;la despensa dulce y desayuno cafes;Café molido natural descafeinado Record 250 g.;1.05;4.2;kg
mercadona-es;cereales y galletas galletas;Bizcochitos Lulu el osito;1.25;8.33;kg
carrefour-es;la despensa aperitivos frutos secos;Nuez cascara Carrefour granel 500 g aprox;2.9;5.8;kg
mercadona-es;marisco y pescado pescado congelado;Rodajas de emperador pequeñas Hacendado ultracongeladas;8.75;9.72;kg
mercadona-es;bodega licores;Licor dulce Amaretto Del Patriarca;4.7;6.71;l
dia-es;alimentacion conservas pescado sardinas y sardinillas;DIA sardinas en aceite de oliva lata 80 gr;1.05;12.35;g
carrefour-es;limpieza y hogar productos para toda la casa suelos;Limpiador multisuperficies aroma océano Cif 1,5 l.;2.2;1.47;l
mercadona-es;conservas caldos y cremas atun y otras conservas de pescado;Bonito del norte en aceite de oliva Albo;2.98;36.34;kg
carrefour-es;la despensa dulce y desayuno dulces y golosinas;Caramelos masticables de frutas Sugus sin gluten 1 kg.;8.55;8.55;kg
carrefour-es;la despensa conservas sopas y precocinados conservas de pescado y marisco;Atún claro en aceite de oliva Isabel sin lactosa pack de 6 latas de 52 g.;5.74;18.4;kg
dia-es;perfumeria e higiene cuidado del cabello mascarillas cabello;FRIZZ EASE serum antiencrespamiento original inmediato dosificador 50 ml;12.49;249.8;ml
carrefour-es;la despensa alimentacion salsas y tomate frito;Tomate frito Solís sin gluten y sin lactosa pack 2 tarros de 460 g.;1.93;2.1;kg
mercadona-es;congelados marisco;Langostino crudo Pescanova ultracongelado;9.25;9.25;kg
mercadona-es;charcuteria y quesos queso curado semicurado y tierno;Queso Maasdam Holland Corona;2.5;6.25;kg
dia-es;alimentacion conservas dulces y mermeladas compotas;DIA mermelada extra albaricoque frasco 650 gr;1.65;2.54;g
carrefour-es;la despensa yogures y postres yogures desnatados;Yogur desnatado de fresa Danone Vitalinea sin gluten pack de 4 unidades de 135 g.;2.1;3.89;kg
dia-es;desayuno dulces y pan caramelos y chicles chicles;DIA chicle sabor hierbabuena sin azúcares bolsa 98 gr;2.09;21.33;g
carrefour-es;la despensa alimentacion aceites y vinagres;Aceite de girasol Carrefour garrafa 5 l.;4.75;0.95;l
carrefour-es;la despensa yogures y postres otros postres;Tarta de queso Miraflores sin gluten 200 g.;1.31;6.55;kg
mercadona-es;cuidado facial y corporal perfume y colonia;Body spray té verde fresco Deliplus;2.5;1.25;ml
carrefour-es;bebidas refrescos tonica;Limonada Fentimans de rosas botella 27,5 cl.;2.96;10.76;l
dia-es;bebidas refrescos bebidas de frutas;BIFRUTAS PASCUAL bebida con leche tropical envase 1 lt;1.69;1.69;ml
carrefour-es;bebidas cava y champagne todos los cavas y champagnes;Cava Castell del Llac dulce 75 cl.;3.15;3.15;ud
mercadona-es;maquillaje ojos;Sombra de ojos perlada Deliplus 09;3.0;3.0;ud
mercadona-es;cuidado facial y corporal afeitado y cuidado para hombre;Brocha de afeitar pelo de tejón Wilkinson;6.75;6.75;ud
carrefour-es;la despensa dulce y desayuno galletas;Galletas de cereales con chocolate Ositos Chiquilín 450 g.;2.9;6.44;kg
mercadona-es;carne embutido;Morcilla de cebolla oreada;1.51;5.04;kg
dia-es;frescos carne y aves cerdo;Fiambre de lomo adobado bandeja 400 gr;2.89;7.23;g
carrefour-es;perfumeria e higiene cabello tinte;T.CREME.GLOSS.CASTING.834;6.6;6.6;ud
carrefour-es;bebidas refrescos colas;Pepsi botella 1,25 l.;1.05;0.84;l
dia-es;mascotas gatos alimento humedo;AS Mix gourmet alimento para gatos con carne tarro 4 x 85 gr;1.66;4.88;g
carrefour-es;el mercado quesos todos los quesos;Mini quesitos Babybel pack de 12 unidades de 20 g.;4.14;17.25;kg
dia-es;bebe higiene gel y jabon;BABYSMILE jabon liquido infantil lavanda botella 750ml;2.05;2.73;ml
carrefour-es;bebidas alcoholes ron;Ron Matusalem gran reserva 15 años 70 cl.;32.05;45.79;l
carrefour-es;bebidas vinos tinto;LOTE 86. Estuche de 2 botellas de vino tinto crianza Marqués de Cáceres D.O. Ca. Rioja 75 cl. + 1 botella tinto crianza Marqués de Cáceres D.O. Ca. Rioja 37,5 cl.;14.6;14.6;ud
carrefour-es;bebidas aguas y zumos zumos no refrigerados;Zumo de piña ecológico Huerta del Sol botella 1 l.;2.95;2.95;l
dia-es;drogueria y limpieza ambientadores continuos y decorativos;AMBIENT AIR ambientador mikado dama de noche 50 ml;2.75;55.0;ml
carrefour-es;la despensa dulce y desayuno mermeladas membrillos y compotas;Mermelada de frutas del bosque cero azúcar La Vieja Fábrica;2.39;8.39;kg
carrefour-es;la despensa conservas sopas y precocinados caldos sopas y pure;Caldo de pollo contenido reducido en sal Carrefour sin gluten 1 l.;0.82;0.82;l
carrefour-es;bebidas cerveza sin alcohol;Cerveza Amstel 0,0 sin alcohol Radler con limón lata 33 cl.;0.64;1.94;l
carrefour-es;bebidas vinos todos los vinos;Manzanilla Solear 75 cl.;7.5;7.5;ud
dia-es;drogueria y limpieza limpiadores para el hogar limpiador multiusos;ESTRELLA limpiador oxígeno activo botella 1.25 lt;2.59;2.07;ml
carrefour-es;bebidas aguas y zumos zumos no refrigerados;Zumo multifrutas Carrefour pack de 6 briks de 20 cl.;1.55;1.29;l
dia-es;drogueria y limpieza insecticidas electricos;BLOOM insecticida eléctrico antimosquitos aparato + 2 recambios;5.99;5.99;ud
carrefour-es;perfumeria e higiene higiene intima bio en higiene intima;Neceser higiene intima con copa menstrual y vaso de limpieza tamaño 1 Dyntas 1ud.;15.6;15.6;ud
carrefour-es;la despensa dulce y desayuno cafes;Café soluble natural classic Nescafé 300 g.;7.77;25.9;kg
carrefour-es;bebidas licores y cremas licores y orujo;Licor de whisky Thunder Bitch 70 cl.;13.05;43.62;ml
carrefour-es;la despensa alimentacion nutricion deportiva;Barrita de frutos secos, semillas y cacahuetes ecológica Taste of Nature 40 g.;1.93;48.25;kg
carrefour-es;bebidas vinos tinto;Vino D.O. Valdepeñas tinto Los Molinos 75 cl.;1.92;1.92;ud
carrefour-es;el mercado frutas fruta de temporada;Granada Carrefour a granel 500 g aprox;0.87;1.75;kg
carrefour-es;el mercado quesos gouda y emmental;Queso emmental taco Carrefour 250 g;2.25;9.0;kg
mercadona-es;conservas caldos y cremas conservas de verdura y frutas;Postre de manzana Jamar;1.45;2.04;kg
carrefour-es;perfumeria e higiene bienestar sexual preservativos;Preservativos natural Durex 12 ud.;6.4;0.53;ud
carrefour-es;bebidas vinos todos los vinos;Estuche 2 Bot. Protos Tinto Roble 2018;15.5;15.5;ud
mercadona-es;bodega vino tinto;Vino tinto D.O Campo de Borja Borsao barrica;2.3;3.07;l
carrefour-es;la despensa dulce y desayuno cacaos y cereales solubles;Mezcla de cereales solubles ecológicos Nestlé Eko 175 g.;2.75;15.71;kg
carrefour-es;mascotas gatos pienso para gatos;Catisfactions Premios para Gatos Sabor Pollo 60gr;1.49;24.83;kg
mercadona-es;bodega licores;Whisky nacional DYC 10 años;14.95;21.36;l
dia-es;perfumeria e higiene colonias masculinas;BRUMMEL colonia spray 125 ml;7.95;63.6;ml
carrefour-es;limpieza y hogar cuidado de la ropa detergentes;Detergente liquido delicate Carrefour Expert 40 lavados.;2.55;0.06;ud
dia-es;congelados y helados verdura y fruta patatas;DIA patatas prefritas bolsa 1 Kg;0.99;0.99;g
mercadona-es;bebe toallitas y panales;Pañales bebé talla 1 de 2-5 kg Dodot;5.99;0.21;ud
carrefour-es;bebidas refrescos energeticas;Monster Mango Loco bebida energética 50 cl.;1.2;2.4;l
dia-es;drogueria y limpieza cuidado ropa  detergente prendas delicadas;NORIT detergente a mano líquido cuidado delicado botella 48 lv;4.19;0.09;ud
mercadona-es;agua y refrescos refresco de naranja y de limon;Refresco de limón Hacendado fresh gas;0.4;0.8;l
dia-es;mascotas accesorios accesorios;MENFORSAN champú hidratante para perros bote 300 ml;4.99;16.63;ml
carrefour-es;la despensa dulce y desayuno mermeladas membrillos y compotas;Mermelada de fresa ecológica Carrefour Bio 350 g.;1.99;5.69;kg
carrefour-es;mascotas gatos pienso para gatos;Alimento Húmedo para Gato con Pollo y Zanahorias 400gr;0.35;0.87;kg
carrefour-es;la despensa alimentacion pastas;Fusilli lunghi Garofalo 500 g.;2.65;5.3;kg
carrefour-es;bebe alimentacion infantil postres zumos petit y yogures infantiles;Bolsita de plátano, pera y naranja con avena ecológica Organix 100 g.;1.15;11.5;kg
carrefour-es;la despensa conservas sopas y precocinados platos preparados;Lasaña de atún La Cocinera 530 g.;3.69;6.96;kg
carrefour-es;el mercado verduras y hortalizas setas y hongos;Surtido setas deshidratadas  bandeja 30 g;5.29;176.33;kg
dia-es;perfumeria e higiene colonias femeninas;AIRE DE SEVILLA agua fresca de rosas blancas spray 30 ml;4.65;155.0;ml
carrefour-es;parafarmacia higiene bucal cuidado y fijacion protesis dentales;Crema Adhesiva Clasica Tamaño Ahorro Kukident 70 g.;10.82;15.46;g
carrefour-es;limpieza y hogar papeleria accesorios manualidades;Bolsa de Ojos Móviles Ovalados Surtidos 40 uds;2.2;0.06;ud
dia-es;frescos pescado y marisco pescado al corte;Gambón crudo bolsa (peso aprox. 500 gr);4.95;9.89;g
dia-es;mascotas gatos alimento humedo;DIA alimento  para gatos bocaditos pollo y legumbres lata 400 gr;0.45;1.13;g
carrefour-es;limpieza y hogar menaje cuberteria;Set de 3 Cucharilla de Acero Inoxidable BERGNER Limoges 3pz - Inox;4.5;9.40;ud
carrefour-es;bebe perfumeria e higiene crema corporal talcos y antiirritacion;Crema hidratante fragancia original Nenuco 400 ml.;3.4;0.85;ml
mercadona-es;panaderia y pasteleria bolleria de horno;Trenza con nueces de Pecán 4%;0.6;7.5;kg
carrefour-es;el mercado pescaderia gulas surimi elaborados;Sueños (Angulas) 200 g.;1.55;7.75;kg
carrefour-es;la despensa alimentacion salsas y tomate frito;Salsa al pesto rosso Gallo 190 g.;1.92;10.11;kg
carrefour-es;bebidas sidra todas las sidras;Sidra Maeloc achampanada sabor mora pack de 4 botellas de 20 cl.;2.95;3.69;l
dia-es;alimentacion aceitunas y encurtidos encurtidos;DIA alcaparras en vinagre frasco 80 gr;1.02;12.75;g
carrefour-es;el mercado quesos curado;Queso curado de cabra graso corteza al pimentón Villuerca El Consorcio de Quesos 1/2 pieza 300 g aprox;5.67;18.9;kg
carrefour-es;limpieza y hogar cuidado de la ropa suavizantes;Suavizante concentrado de agua de coco y minerales Aromaterapia+ Vernel 76 lavados.;3.25;0.04;ud
mercadona-es;pizzas y platos preparados pizzas;Pizza masa fina 4 quesos Hacendado ultracongelada;2.2;5.64;kg
carrefour-es;la despensa alimentacion legumbres;Alubia blanca premium Don Pedro 1 kg.;3.05;3.05;kg
dia-es;alimentacion conservas pescado calamares chipirones y pulpo;ALBO calamares en su tinta lata 72 gr;2.25;31.25;g
dia-es;bebidas refrescos bebidas de frutas;DIA bebida de zumo de limón lata 33 cl;0.29;0.88;ml
carrefour-es;bebidas refrescos tonica;Tónica Nordic Mist botella 1 l.;1.38;1.38;l
carrefour-es;la despensa yogures y postres yogur natural y sabores;Yogur de plátano Danone sin gluten pack de 4 unidades de 120 g.;1.0;2.08;kg
mercadona-es;azucar caramelos y chocolate chocolate;Chocolate con leche Valor almendras enteras;2.55;17.0;kg
mercadona-es;cuidado del cabello coloracion cabello;Coloración permanente 7.13 rubio beige Deliplus 0% amoníaco;3.9;3.9;ud
carrefour-es;perfumeria e higiene boca y sonrisa dentifricos;Dentífrico blanqueador one Max White Colgate 75 ml.;2.7;3.6;ml
mercadona-es;agua y refrescos agua;Agua mineral grande Solán de Cabras;4.2;0.47;l
carrefour-es;la despensa alimentacion salsas y tomate frito;Tomate frito con aceite de oliva virgen extra Orlando pack de 3 briks de 350 g.;2.46;2.34;kg
mercadona-es;bodega vino tinto;Vino tinto D.O La Mancha Fidencio;1.2;1.6;l
carrefour-es;parafarmacia botiquin tos y garganta;Caramelo de hierbas sin azúcar Ricola Multi-Active 51 g.;3.65;7.16;g
carrefour-es;la despensa yogures y postres yogur natural y sabores;Yogur de cabra desnatado ecológico Cantero de Letur 420 g.;3.0;7.14;kg
carrefour-es;el mercado charcuteria fiambre de pavo y pollo;Pechuga de pavo en lonchas El Pozo sin gluten 200 g.;2.1;10.5;kg
dia-es;frescos pescado y marisco especialidades;ROYAL huevas de islandia de lumpus y capelan tarro 50 gr;1.89;37.8;g
carrefour-es;la despensa yogures y postres gelatina;Gelatina de sabores Carrefour pack de 6 unidades de 100 g.;0.8;1.33;kg
mercadona-es;marisco y pescado sushi;Nigiris langostino;3.75;39.47;kg
carrefour-es;el mercado panaderia bolleria y pasteleria magdalenas dulces y bollos;Bizcochos La filo 300 g.;1.17;3.9;kg
carrefour-es;perfumeria e higiene cosmetica unas;Quitaesmalte Babaria 200 ml.;1.4;0.7;ml
carrefour-es;el mercado panaderia bolleria y pasteleria pan de molde tostado y picos;Pan crujiente de levadura tres semillas Chrupak 180 g.;2.6;14.44;kg
carrefour-es;la despensa dulce y desayuno cafes;Café Guatemala en cápsulas L'or Espresso compatible con Nespresso 10 unidades de 5,2 g.;3.4;65.38;kg
dia-es;drogueria y limpieza accesorios limpieza estropajos;SCOTCH BRITE estropajo salvauñas fibra negra BBQ paquete 1 ud;2.15;2.15;ud
carrefour-es;perfumeria e higiene cabello champus;Champú suave y liso Pantene 700 ml.;5.7;0.81;ml
mercadona-es;bodega licores;Licor de anís dulce Regio;5.89;5.89;L
carrefour-es;la despensa dulce y desayuno dulces y golosinas;Ladrillos de goma Carrefour 200 g.;0.82;4.1;kg
dia-es;desayuno dulces y pan galletas salud;GULLON DIET NATURE doradas al horno sin azúcar caja 330 grs;2.79;8.45;g
carrefour-es;la despensa yogures y postres yogures griegos y enriquecidos;Yogur estilo griego sirtaki de cítricos ecológico Casa Grande Xanceda 400 g.;2.9;7.25;kg
carrefour-es;perfumeria e higiene cuidado y proteccion corporal body milk hidratacion bajo la ducha;Crema corporal hidratante para pieles atópicas Carrefour 400 ml.;2.2;0.55;ml
mercadona-es;charcuteria y quesos bacon y salchichas;Bacón Hacendado cintas;1.95;7.8;kg
carrefour-es;limpieza y hogar productos para toda la casa limpiacristales y multiusos;Vinagre de limpieza multiusos Carrefour 1 l.;0.86;0.86;l
carrefour-es;el mercado panaderia bolleria y pasteleria magdalenas dulces y bollos;Tarta de albaricoque Dolce Genuino 400 g.;2.2;5.5;kg
dia-es;lacteos y huevos postres gelatina;DIA postre gelificado de fresa, limón y multifrutas pack 6 unidades 100 gr;0.85;1.42;g
carrefour-es;bebe alimentacion infantil leches infantiles;Leche infantil de continuación desde 6 meses en polvo Blemil Plus Optimum 2 lata 800 g.;21.35;26.69;kg
carrefour-es;el mercado charcuteria jamon cocido y lacon;Jamón cocido loncha fina sin sal 200 g;1.8;9.0;kg
carrefour-es;limpieza y hogar productos para cocina lavavajillas a maquina;Lavavajillas máquina 0% en pastillas Calgonit Finish 32 ud.;10.45;0.33;ud
mercadona-es;aperitivos aceitunas y encurtidos;Aceitunas aliñadas Hacendado sin hueso;2.4;6.0;kg
dia-es;desayuno dulces y pan chocolates y bombones tabletas;MILKYBAR chocolate blanco con galleta tableta 100 gr;1.59;15.9;g
mercadona-es;huevos leche y mantequilla leche y bebidas vegetales;Bebida láctea sabor canela y limón Hacendado;1.6;1.33;l
carrefour-es;la despensa dulce y desayuno mermeladas membrillos y compotas;Mermelada de fresa La Vieja Fábrica 350 g.;1.99;5.69;kg
mercadona-es;pizzas y platos preparados platos preparados calientes;Alubias a la jardinera Hacendado;0.79;1.88;kg
carrefour-es;la despensa yogures y postres proteina;Yogur líquido desnatado sabor cookies y vainilla alto en proteínas Danone sin lactosa YoPRO 300 g.;1.93;6.43;kg
mercadona-es;agua y refrescos refresco de cola;Refresco Coca-Cola Zero azúcar;6.96;1.76;l
mercadona-es;bebe alimentacion infantil;Papilla instantánea 8 cereales Nestlé +6 meses;3.8;5.76;kg
carrefour-es;el mercado verduras y hortalizas verduras y hortalizas congeladas;Coliflor Carrefour 1 kg.;1.29;1.29;kg
mercadona-es;congelados pescado;Anillas de pota Argentina Hacendado congeladas;4.6;12.78;kg
dia-es;lacteos y huevos mantequilla y margarina margarina;FLORA OLIVA margarina barqueta 250 g;1.65;6.6;g
mercadona-es;bodega licores;Ginebra London dry gin Larios;10.65;10.65;l
carrefour-es;la despensa dulce y desayuno chocolates turrones y bombones;Bombones de chocolate con leche rellenos de crema de cacahuete Arcor 18 unidades de 17 g.;5.09;18.85;kg
mercadona-es;mascotas gato;Mousse de lenguado gato adulto Delikuit;1.7;5.0;kg
carrefour-es;el mercado quesos tierno;Queso de cabra tierno Carrefour 480 g aprox;6.22;12.95;kg
dia-es;perfumeria e higiene higiene bucal productos protesicos;POLIDENT crema fijadora para prótesis dental protección encías tubo 40 gr;5.69;142.25;g
carrefour-es;bebidas cava y champagne cavas;Estuche de 2 botellas de Champagne Freixenet brut nature reserva D.O. Cava 75 cl. + 2 copas de regalo;17.99;17.99;ud
carrefour-es;la despensa conservas sopas y precocinados gazpacho y salmorejo;Gazpacho con aceite de oliva virgen extra Carrefour sin gluten pack de 3 unidades de 330 ml.;1.75;1.77;l
carrefour-es;bebe perfumeria e higiene bastoncillos algodon y sueros;Bastoncillos suaves Johnson's 200 ud.;3.1;0.02;ud
dia-es;alimentacion aceitunas y encurtidos encurtidos;DIA pepinillos sabor anchoa frasco 180 gr;1.09;6.06;g
carrefour-es;bebidas vinos blanco;Vino de la Tierra de Castilla blanco verdejo Viña Lobón 75 cl.;3.0;3.0;ud
dia-es;alimentacion conservas pescado calamares chipirones y pulpo;DIA chipirones rellenos en salsa americana lata 72 gr;1.99;27.64;g
carrefour-es;limpieza y hogar productos para cocina lavavajillas a maquina;Lavavajillas máquina 0% en gel ecológico Calgonit Finish 60 lavados;10.1;0.17;ud
dia-es;bebe higiene puericultura;NUBY cepillo para biberones y tetinas 1 ud (diferentes colores);6.7;6.7;ud
carrefour-es;bebidas aguas y zumos zumos no refrigerados;Zumo de fruta y leche Carrefour Tropical sin lactosa pack de 6 briks de 20 cl.;1.38;1.15;l
carrefour-es;la despensa conservas sopas y precocinados caldos sopas y pure;Caldo natural de pollo ecológico Aneto sin gluten 1 l.;4.9;4.9;l
mercadona-es;maquillaje labios;Pintalabios Bom Bom creamy Deliplus 02;4.5;4.5;ud
carrefour-es;la despensa conservas sopas y precocinados pizzas;Pizza prosciutto Ristorante Dr. Oetker 330 g.;3.6;10.91;kg
carrefour-es;bebidas aguas y zumos zumos no refrigerados;Zumo de piña Juver-Disfruta sin azúcar añadido pack de 6 briks de 20 cl.;2.35;1.96;l
carrefour-es;el mercado quesos todos los quesos;Queso de untar original Philadelphia 350 g;2.7;7.71;kg
carrefour-es;perfumeria e higiene cabello cepillos peines y accesorios;Horquilla clásicas Ponette 20 ud.;1.61;0.08;ud
carrefour-es;limpieza y hogar cuidado de la ropa suavizantes;Suavizante concentrado de lirio irresistible Aromaterapia Vernel 76 lavados.;3.25;0.04;ud
carrefour-es;la despensa huevos huevos frescos;Huevos L Carrefour 6 ud.;0.95;1.9;ud
carrefour-es;bebe alimentacion infantil tarritos y platos preparados;Tarrito de verduras con jamón y ternera desde 6 meses Hero Baby 235 g.;0.99;4.21;kg
carrefour-es;la despensa yogures y postres bifidus;Yogur bífidus con espelta y semillas de amapola Danone Activia pack de 4 unidades de 120 g.;2.09;4.35;kg
dia-es;desayuno dulces y pan caramelos y chicles caramelos duros;HALLS caramelo sabor miel-limón paquete 2 uds 67 gr;1.79;26.72;g
carrefour-es;el mercado panaderia bolleria y pasteleria magdalenas dulces y bollos;Miguelitos de chocolate blanco Ruiz 500 g;7.5;15.0;kg
carrefour-es;parafarmacia higiene bucal pasta de dientes;Dentífrico protección completa Parodontax 75 ml.;6.2;8.27;ml
dia-es;alimentacion aceite aceite de oliva virgen y virgen extra;DIA DELICIOUS aceite virgen extra picual botella 500 ml;2.99;5.98;ml
mercadona-es;fruta y verdura fruta;Peras conferencia;2.39;1.59;kg
carrefour-es;perfumeria e higiene cosmetica labios;Bálsamo labial ultrahidratante berry Carmex 2 g.;5.7;5.7;ud
mercadona-es;cuidado facial y corporal depilacion;Maquinilla depilación Hydro silk bikini Wilkinson;9.95;9.95;ud
dia-es;desayuno dulces y pan cafe molido mezcla;FORTALEZA café molido mezcla paquete 250 gr;2.45;9.8;g
mercadona-es;limpieza y hogar utensilios de limpieza y calzado;Acondicionador de cuero Bosque Verde limpiador y nutriente;3.85;15.4;l
carrefour-es;perfumeria e higiene cosmetica accesorios de maquillaje y manicura y pedicura;Tijeras manicura Beter 1 ud.;7.5;7.5;ud
carrefour-es;mascotas gatos pienso para gatos;Purina Gourmet Diamant Comida Húmeda para Gato Finas Lonchas Carnes Asadas Pollo 85g;1.24;1.24;ud
dia-es;bebidas alcoholes y licores licor sin alcohol;SOBERANO brandy de Jerez botella 70 cl;6.29;8.99;cl
mercadona-es;charcuteria y quesos queso curado semicurado y tierno;Queso Gruyère Natual;2.6;13.0;kg
carrefour-es;perfumeria e higiene cosmetica labios;Barra de labios nº 203 magnetiza L'Oreal 1 ud.;14.5;14.5;ud
carrefour-es;el mercado charcuteria y quesos al corte fiambres y cocidos;Jamón de pavo al corte 150 g aprox;1.98;13.2;kg
mercadona-es;maquillaje bases de maquillaje y corrector;Corrector camouflage perfectionist Deliplus 01;4.5;4.5;ud
carrefour-es;el mercado charcuteria fiambre de pavo y pollo;Redondo de pollo asado c/queso cabra y cebolla caramelizada Asados la Carloteña 250 g;2.95;11.8;kg
carrefour-es;la despensa aperitivos aceitunas y encurtidos;Aceitunas verdes rellenas de anchoa Carrefour pack de 3 unidades de 150 g.;1.9;4.22;kg
carrefour-es;la despensa lacteos leche;Leche semidesnatada Lauki brik 1 l.;0.79;0.79;l
carrefour-es;limpieza y hogar ambientadores aerosol o pistola;Ambientador eliminaolor Air Effects Brisa Marina Ambipur 300 ml.;3.45;11.5;l
carrefour-es;bebidas aguas y zumos agua con sabor;Agua mineral Solán de Cabras natural multifrutas 33 cl.;0.74;2.24;l
mercadona-es;maquillaje bases de maquillaje y corrector;Stick iluminador perfectionist Deliplus 02;5.5;5.5;ud
dia-es;perfumeria e higiene cuidado corporal cremas cuerpo  body milk;NIVEA Creme crema hidratante universal formato viaje lata 30 ml;1.5;50.0;ml
dia-es;desayuno dulces y pan galletas salud;GULLON Active galletas de desayuno integrales bolsa 280 grs;1.09;3.89;g
carrefour-es;bebe perfumeria e higiene colonia;Colonia infantil ecológica Natural Denenes 500 ml.;4.25;0.85;ml
carrefour-es;la despensa alimentacion aceites y vinagres;Vinagre ecológico de manzana Carandini 500 ml.;2.75;5.5;l
dia-es;bebe higiene gel y jabon;JOHNSON´S Baby gel de baño pure protect bote 500 ml;3.99;7.98;ml
carrefour-es;la despensa dulce y desayuno reposteria para preparar;Preparado para bizcocho Dr. Oetker 340 g.;2.5;7.35;kg
mercadona-es;cuidado del cabello coloracion cabello;Coloración permanente Deliplus 7.40 rubio cobrizo intenso;3.9;3.9;ud
carrefour-es;el mercado panaderia bolleria y pasteleria panettones;Panettone con profiteroles Bauli 750 g.;13.75;18.33;kg
carrefour-es;el mercado panaderia bolleria y pasteleria masa fresca y bases;Masa de hojaldre Casa Tarradellas 260 g.;1.54;5.92;kg
mercadona-es;maquillaje ojos;Perfilador de cejas definidor Deliplus 01;3.95;3.95;ud
carrefour-es;el mercado verduras y hortalizas ensaladas y verduras preparadas;Ensalada brotes deluxe Carrefour 110 g;1.75;15.91;kg
carrefour-es;la despensa aperitivos aceitunas y encurtidos;Pepinillos ecológicos Campomar Nature 180 g.;2.6;13.68;kg
carrefour-es;bebidas aguas y zumos zumos refrigerados;Smoothie de mango, maracuyá, banana y manzana ecológico Be Green botella 30 cl.;3.05;10.17;l
carrefour-es;la despensa dulce y desayuno dulces y golosinas;Chicles sabor sandía Trident 3 paquetes de 20 g.;1.79;2.98;kg
