dia-es;congelados y helados pescado y marisco palitos de cangrejo surimi y gulas;DIA palitos de mar envase 450 gr;1.59;3.53;g
carrefour-es;la despensa dulce y desayuno miel;Miel de flores cecológica Pazo de Lusio 500 g.;6.95;13.9;kg
carrefour-es;bebidas vinos tinto;Cune Tinto Crianza 2017;6.55;6.55;ud
carrefour-es;bebidas aguas y zumos zumos no refrigerados;Zumo de piña ecológico Delizum botella 20 cl.;0.86;4.3;l
carrefour-es;perfumeria e higiene cabello champus;Champú hidratación Syoss 440 ml.;3.95;0.9;ml
carrefour-es;mascotas gatos premios y snacks;Whiskas Anti-Hairball para Bolas de Pelo de Uso Diario para Gatos 60gr;2.1;35.0;kg
carrefour-es;el mercado quesos con denominacion origen;Queso Brie con azul Millán Vicente cuña 250 g;3.22;12.9;kg
carrefour-es;la despensa aperitivos aceitunas y encurtidos;Aceitunas verdes rellenas de anchoa La Española pack de 6 latas de 50 g.;4.25;14.17;kg
carrefour-es;el mercado verduras y hortalizas verduras y hortalizas congeladas;Ensaladilla Carrefour 1 kg.;0.7;0.7;kg
carrefour-es;limpieza y hogar cuidado de la ropa suavizantes;Suavizante concentrado azul vital Mimosín 166 lavados.;6.35;0.04;ud
mercadona-es;pizzas y platos preparados pizzas;Pizza ibérica Hacendado ultracongelada;2.0;5.26;kg
dia-es;desayuno dulces y pan chocolates y bombones grajeas y huevos chocolate;DIA grageas de chocolate bolsa 250 gr;2.12;8.48;g
mercadona-es;limpieza y hogar lejia y liquidos fuertes;Lejía con detergente Estrella limón;1.69;1.25;l
mercadona-es;panaderia y pasteleria picos rosquilletas y picatostes;Picatostes fritos Hacendado;0.75;7.5;kg
carrefour-es;la despensa aperitivos tortitas;Tortitas de arroz integrales con chocolate blanco aroma yogur Carrefour 130 g.;1.5;11.54;kg
dia-es;perfumeria e higiene afeitado espuma gel y crema afeitar;GILLETTE Fusion proglide gel de afeitar 2 en 1 ocean breeze spray 170 ml;5.99;35.24;ml
carrefour-es;bebe perfumeria e higiene crema corporal talcos y antiirritacion;Crema corporal aceite de almendra Carrefour Baby 500 ml.;2.99;0.4;ml
carrefour-es;limpieza y hogar cuidado de la ropa detergentes;Detergente líquido Colonia Fresca Carrefour 40 lavados.;3.3;0.08;ud
carrefour-es;el mercado pescaderia pescado y marisco congelado;Gamba pelada pequeña congelada Pescatrade 400 g;4.95;12.38;kg
carrefour-es;la despensa conservas sopas y precocinados croquetas y rebozados;Tempura 5 verduras Carrefour 400 g.;1.87;4.67;kg
carrefour-es;bebe alimentacion infantil tarritos y platos preparados;Tarrito de verduras con merluza desde 8 meses Hero Baby 235 g.;0.99;4.21;kg
dia-es;desayuno dulces y pan caramelos y chicles caramelos duros;CHUPA CHUPS mini original bolsa 20 uds 120 gr;1.99;16.58;g
carrefour-es;parafarmacia cuidado corporal cremas y lociones;Pomada para curar heridas Hansaplast 20 g.;5.15;5.15;ud
mercadona-es;huevos leche y mantequilla leche y bebidas vegetales;Leche entera Hacendado;0.59;0.59;l
carrefour-es;la despensa dulce y desayuno chocolates turrones y bombones;Turrón praliné de mandarina y merengue Lacasa sin aceite de palma 200 g.;5.4;27.0;kg
carrefour-es;la despensa alimentacion aceites y vinagres;Vinagre de vino blanco Carrefour 1 l.;0.49;0.49;l
dia-es;alimentacion patatas fritas aperitivos y frutos secos patatas fritas;DIA patatas fritas artesanas bolsa 2 x 150 gr;1.35;4.5;g
carrefour-es;la despensa dulce y desayuno mermeladas membrillos y compotas;Dulce de batata Márdel sin gluten 370 g.;2.7;7.3;kg
carrefour-es;limpieza y hogar papeleria colorear;Ceras Manley 15 uds.;4.65;0.31;ud
carrefour-es;bebidas cerveza todas las cervezas;Cerveza Amstel 0,0 sin alcohol pura malta lata 33 cl.;0.58;1.76;l
dia-es;congelados y helados helados galletas y cucuruchos para helado;MAGNUM helado bombón double chocolate & strawberry caja 3 uds 219 gr;3.69;16.85;g
carrefour-es;bebidas vinos tinto;Vino D.O. Rioja tinto Faustino VII 75 cl.;3.75;3.75;ud
carrefour-es;el mercado panaderia bolleria y pasteleria pan de molde tostado y picos;Baguetinas congeladas Maheso pack de 4 unidades de 125 g.;2.0;4.0;kg
mercadona-es;marisco y pescado salazones y ahumados;Sucedáneo de caviar negro Ubago Caviartic;1.85;24.67;kg
carrefour-es;bebidas aguas y zumos agua de 075 a 2 litros;Agua de manantial Voss en botella de vidrio 80 cl.;5.8;7.25;l
carrefour-es;bebidas licores y cremas licores y orujo;Licor de manzana verde Loch Castle 70 cl.;2.65;3.79;l
carrefour-es;bebidas alcoholes todos los alcoholes;Vermut Martini Fiero 75 cl.;10.25;13.67;l
mercadona-es;cuidado facial y corporal depilacion;Bálsamo para depués de la depilación Deliplus;2.75;1.38;ml
carrefour-es;la despensa aperitivos frutos secos;Avellana con cáscara gigante Carrefour a granel 500 g aprox;4.47;8.95;kg
mercadona-es;conservas caldos y cremas sopa y caldo;Tallarines a la carbonara Hacendado;1.1;5.79;kg
mercadona-es;cuidado facial y corporal gel y jabon de manos;Esponja de baño infantil Disney Frozen;1.6;1.6;ud
carrefour-es;el mercado panaderia bolleria y pasteleria magdalenas dulces y bollos;Pastel Pantera Rosa Bimbo pack de 3 unidades de 55 g.;1.56;9.45;kg
carrefour-es;el mercado charcuteria y quesos al corte fiambres y cocidos;Mortadela big bologna Oscar Mayer al corte 150 g aprox;1.56;10.4;kg
carrefour-es;limpieza y hogar bazar automovil;Batería de Moto 12V 8AH Carrefour;40.95;42.99;kg
carrefour-es;parafarmacia cuidado corporal cremas y lociones;Bálsamo relipidizante La Roche-Posay 400 ml;18.8;4.7;ml
carrefour-es;el mercado la cocina de carrefour platos de carne y pescado;Chipirones en su tinta 500 g aprox;10.0;20.0;kg
carrefour-es;bebidas aguas y zumos agua de 075 a 2 litros;Agua mineral Aquarel Mr. Wonderful natural 1 l.;0.85;0.85;l
mercadona-es;cacao cafe e infusiones cafe capsula y monodosis;Cortado en cápsula Hacendado;3.3;32.74;kg
carrefour-es;mascotas perros pienso para perros;Pienso de pollo para perro adulto Medium Maxi Ultima Nature 3 Kg.;14.28;4.76;kg
dia-es;mascotas accesorios accesorios;MENFORSAN líquido anti orines para perros y gatos pistola 500 ml;5.99;5.99;ud
mercadona-es;cuidado facial y corporal perfume y colonia;Eau de toilette mujer Complicity;8.0;8.0;ml
carrefour-es;el mercado la cocina de carrefour pasta y pizza;Pasta carbonara de setas 1 kg aprox;10.0;10.0;kg
carrefour-es;el mercado pescaderia marisco almejas y mejillones;Caracoles precocinados ultracongelados 450 g;3.5;7.78;kg
carrefour-es;la despensa alimentacion harinas y levaduras;Harina de trigo Carrefour 2 kg.;0.84;0.42;kg
carrefour-es;la despensa dulce y desayuno galletas;Galletas de cereales y chocolate Chiquilín 250 g.;2.15;10.75;kg
mercadona-es;pizzas y platos preparados platos preparados calientes;Alubias a la riojana Hacendado;0.9;2.14;kg
carrefour-es;la despensa dulce y desayuno cereales y barritas;Cereales con chocolate Weetos Weetabix 375 g.;2.49;6.64;kg
mercadona-es;maquillaje bases de maquillaje y corrector;Maquillaje fluido Deliplus natural radiante 02;5.5;18.33;ml
mercadona-es;azucar caramelos y chocolate chocolate;Chocolate extrafino negro Hacendado con pepitas de cacao tostadas;0.9;9.0;kg
mercadona-es;mascotas perro;Comida perro júnior Supreme Compy con pollo y arroz;4.15;2.77;kg
carrefour-es;la despensa aperitivos frutos secos;Ciruela con hueso Carrefour tarrina 350 g;2.5;7.14;kg
carrefour-es;bebidas vinos tinto;Vino de la Tierra de Castilla y León tinto crianza Dehesa La Granja 75 cl.;9.5;9.5;ud
carrefour-es;la despensa alimentacion aceites y vinagres;Aceite de oliva virgen extra De Nuestra Tierra D.O. Sierra de Segura lata 5 l.;22.99;4.6;l
mercadona-es;aperitivos frutos secos y fruta desecada;Semillas sésamo tostado Hacendado;1.15;7.67;kg
carrefour-es;limpieza y hogar productos para toda la casa limpiacristales y multiusos;Limpiador Multiusos Sanytol Pistola 750 ml;2.4;3.2;l
mercadona-es;conservas caldos y cremas conservas de verdura y frutas;Frutas rojas en zumo de uva Hacendado;1.1;10.0;kg
dia-es;perfumeria e higiene botiquin alcohol agua oxigenada y otros;HANSAPLAST limpia heridas spray 100 ml;5.55;55.5;ml
dia-es;alimentacion legumbres alubias cocidas;DIA alubia roja cocida frasco 400 gr;0.79;1.98;g
carrefour-es;el mercado panaderia bolleria y pasteleria pan de molde tostado y picos;Pan de molde sin corteza buenisimo Bimbo 450 g.;2.05;5.35;g
mercadona-es;cuidado facial y corporal manicura y pedicura;Laca de uñas alto brillo Deliplus 20 rosa magnético;2.5;22.73;ml
carrefour-es;perfumeria e higiene boca y sonrisa protector labial;Bálsamo labial hidratante Carrefour 1 ud.;1.71;21.38;g
carrefour-es;parafarmacia cabello champus anticaida;Champú anticaída Pilexil 500 ml.;14.85;2.97;ml
carrefour-es;bebidas aguas y zumos zumos no refrigerados;Bebida de piña Carrefour sin azúcar añadido brik 1 l.;0.65;0.65;l
carrefour-es;la despensa alimentacion aceites y vinagres;Vinagre de vino blanco Carrefour 1 l.;0.49;0.49;l
carrefour-es;la despensa dulce y desayuno chocolates turrones y bombones;Bombones de chocolate con leche Lindt Lindor 75 g.;2.1;28.0;kg
mercadona-es;postres y yogures yogures liquidos;Bebida láctea de piña y coco Hacendado;1.16;1.16;kg
carrefour-es;el mercado quesos queso fresco;Queso fresco batido 0% m.g Carrefour 500 g.;1.03;2.06;kg
mercadona-es;cuidado del cabello coloracion cabello;Coloración permanente Deliplus 9 rubio clarísimo;3.9;3.9;ud
carrefour-es;perfumeria e higiene cosmetica unas;Laca de uñas Super Gel manicura francesa nº 091 English Rose Rimmel 1 ud.;5.1;5.1;ud
carrefour-es;el mercado quesos todos los quesos;Queso rallado emmental Carrefour 200 g.;1.11;5.55;kg
carrefour-es;la despensa aperitivos frutos secos;Almendras tostadas sin cáscara sin sal añadida ecológicas Carrefour Bio 90 g.;1.93;21.44;kg
dia-es;frescos carne y aves ternera;ROLER estofado de vacuno bandeja 500 gr;3.99;7.98;g
carrefour-es;el mercado panaderia bolleria y pasteleria magdalenas dulces y bollos;Magdalenas cuadradas Casado 12 ud.;0.63;1.8;kg
dia-es;otros curados;DIA chorizo sarta extra picante envase 280 gr;2.1;7.5;g
carrefour-es;el mercado quesos bio en quesos;Queso maasdam ecológico Carrefour Bio taco 200 g;3.6;18.0;kg
carrefour-es;bebidas vinos estuches de vino;Estuche vacío para 1 botella de vino color burdeos Papstar 1 ud.;1.61;1.61;ud
carrefour-es;parafarmacia cuidado corporal cremas y lociones;Crema de manos Atopi control para piel seca pack 2 unidades de 75 ml.;9.5;6.33;ml
dia-es;desayuno dulces y pan infusiones tila;DIA infusión de tila estuche 25 bolsitas;0.49;0.49;ud
carrefour-es;el mercado panaderia bolleria y pasteleria panaderia tradicional;Pan bocata sin aditivos 5 ud;1.0;1.82;kg
mercadona-es;fruta y verdura fruta;Pomelo;0.66;1.79;kg
dia-es;alimentacion pizza bases y masas pizza congelada;DIA pizza ricotta y tomate cherry caja 2 x 300 gr;2.99;9.97;g
carrefour-es;bebidas refrescos sabores con gas;Refresco de naranja ecológico Hollinger con gas lata 25 cl.;1.02;4.08;l
dia-es;perfumeria e higiene limpieza facial limpieza desmaquilladores;BONTE toallitas desmaquillantes para pieles maduras envase 25 uds;1.15;1.15;ud
carrefour-es;perfumeria e higiene higiene intima incontinencia;Compresas para pérdidas de orina moderadas o abundantes Maxi Tena Lady 12 ud.;6.7;0.56;ud
mercadona-es;charcuteria y quesos pate y sobrasada;Paté de cerdo con pimienta Hacendado;0.9;5.63;kg
carrefour-es;la despensa alimentacion pastas;Fideo cabellín Carrefour 1 kg.;0.78;0.78;kg
dia-es;desayuno dulces y pan azucar y edulcorantes azucar;AZUCARERA azúcar moreno integral en terrones caja 500 gr;1.45;2.9;g
dia-es;alimentacion caldos sopas y pures caldo concentrado y pastillas;GALLINA BLANCA avecrem pollo estuche 24 pastillas;2.89;0.12;ud
carrefour-es;la despensa dulce y desayuno infusiones y tes;Té Chai con especias en bolsitas Hornimans 20 ud.;2.2;0.11;ud
carrefour-es;el mercado pescaderia ahumados y huevas;Solomillos de salmón ahumado Royal Dúo pack de 2 unidades de 50 g.;5.95;59.5;kg
carrefour-es;bebidas aguas y zumos zumos no refrigerados;Zumo de naranja y mandarina Carrefour brik 1 l.;0.69;0.69;l
carrefour-es;perfumeria e higiene depilacion y afeitado depilacion;Recambio de cera tibia en roll on para todo tipo de pieles Veet 50 ml.;8.55;17.1;ml
carrefour-es;la despensa yogures y postres yogur natural y sabores;Yogur de limón, galleta, fresa y macedonia Danone sin gluten pack de 8 unidades de 125 g.;1.99;2.07;kg
carrefour-es;la despensa dulce y desayuno chocolates turrones y bombones;Cacahuete suizo cubierto de chocolate Lacasa 500 g.;3.15;7.0;g
dia-es;congelados y helados pescado y marisco calamar y otros cefalopodos;Sepia limpia (peso aprox. 600 gr);5.97;9.95;g
carrefour-es;limpieza y hogar calzado plantillas de calzado;Plantillas de piel Carrefour 1 par.;3.25;3.25;ud
carrefour-es;limpieza y hogar menaje ordenacion;Set 8 Perchas Infantiles de Plástico Protenrop - Colores Surtidos;1.99;0.25;ud
carrefour-es;bebidas aguas y zumos zumos no refrigerados;Néctar de mango ecológico Delizum botella 1 l.;2.25;2.25;l
carrefour-es;la despensa conservas sopas y precocinados pizzas;Pizza de atún Ristorante Dr. Oetker 355 g.;3.45;9.72;kg
mercadona-es;arroz legumbres y pasta arroz;Arroz Jazmín aromático Hacendado;1.9;1.9;kg
dia-es;charcuteria y quesos salchichas salchichas;DIA salchichas viena con queso envase 3 x 200 gr;1.69;2.82;g
mercadona-es;bodega vino blanco;Vino fino Corredera D.O Montilla-Moriles;2.25;3.0;l
dia-es;drogueria y limpieza limpiadores para el hogar limpiador especifico;CARELI limpiador de cafeteras caja 2 sobres;3.65;18.25;ml
carrefour-es;limpieza y hogar cuidado de la ropa detergentes;Detergente liquido ultra oxi effect Ariel 40 lavados.;13.75;0.34;ud
dia-es;perfumeria e higiene desodorante spray;NIVEA desodorante invisible fresh spray 200 ml;2.89;14.45;ml
mercadona-es;postres y yogures yogures liquidos;Yogur líquido de fresa Hacendado;2.0;1.45;kg
mercadona-es;azucar caramelos y chocolate mermelada y miel;Confitura de melocotón Hacendado;1.0;2.78;kg
mercadona-es;cacao cafe e infusiones te e infusiones;Infusión Manzana y Canela Hacendado;1.3;3.61;g
mercadona-es;marisco y pescado pescado fresco;Dorada abierta a la espalda con espinas y con cabeza;3.96;6.95;kg
dia-es;desayuno dulces y pan chocolates y bombones tabletas;DIA chocolate negro para postres tableta 200 gr;1.09;5.45;g
dia-es;bebidas refrescos sabores;DIA bebida de zumo de manzana botella 1.5 lt;0.79;0.53;l
carrefour-es;perfumeria e higiene cuidado y proteccion corporal piel;Crema facial anti-arrugas de noche Lift + Super Rellenador Diadermine 50 ml.;10.3;20.6;ml
carrefour-es;la despensa alimentacion aceites y vinagres;Vinagre de manzana Ybarra 500 ml.;2.1;4.2;l
carrefour-es;el mercado panaderia bolleria y pasteleria pan de molde tostado y picos;Colines integrales Carrefour 250 g.;0.44;1.76;kg
carrefour-es;bebe alimentacion infantil complementos alimenticios e infusiones para bebe;Infusión instantánea para aliviar gases Almirón Digest 200 g.;6.9;34.5;kg
dia-es;alimentacion pastas espaguetis y tallarines;DIA DELICIOUS pasta tagliatelle al huevo paquete 500 gr;1.15;2.3;g
carrefour-es;el mercado quesos todos los quesos;Queso mozzarella Italiana Carrefour 125 g.;0.78;6.24;kg
carrefour-es;la despensa dulce y desayuno chocolates turrones y bombones;Turrón de Jijona Carrefour sin gluten 250 g.;2.0;8.0;kg
dia-es;alimentacion conservas pescado anchoas;DIA DELICIOUS filetes de anchoa en aceite de oliva lata 55 gr;3.69;67.09;g
carrefour-es;limpieza y hogar utensilios de limpieza fregonas;Fregona Multiusos 100% Microfibras VILEDA  - Rosa;4.0;4.0;ud
dia-es;bebidas vinos blancos valencia;SEÑORIO DE ONDAS Vino blanco semidulce DO Rioja 75 cl;2.35;3.13;cl
dia-es;lacteos y huevos leche en polvo y deshidratada;PASCUAL leche desnatada calcio envase 1 lt;1.39;1.39;l
carrefour-es;la despensa dulce y desayuno infusiones y tes;Té Indian Chai en bolsitas Pompadour 20 ud.;2.2;55.0;kg
mercadona-es;marisco y pescado pescado congelado;Chipirón puntilla Hacendado congelado;3.75;8.33;kg
carrefour-es;el mercado panaderia bolleria y pasteleria magdalenas dulces y bollos;Bizcochos con naranja con una fina capa de chocolate Carrefour 300 g.;0.99;3.3;kg
dia-es;bebidas alcoholes y licores ron;VELERO ron blanco botella 70 cl;4.79;6.84;cl
mercadona-es;carne aves y pollo;Medallones pechuga de pollo marinado;4.0;6.15;kg
dia-es;perfumeria e higiene cuidado facial contorno de ojos;BABARIA contorno de ojos aloe 15 ml;6.95;463.33;ml
carrefour-es;bebidas aguas y zumos zumos no refrigerados;Zumo de zanahoria y aloe ecológico Delizum botella 1 l.;2.65;2.65;l
carrefour-es;bebidas vinos blanco;Vino blanco Libalis by Maetierra I.G.P. Valles de Sadacia 75 cl.;5.95;5.95;ud
mercadona-es;cuidado facial y corporal perfume y colonia;Eau de toilette mujer Ikiru;8.0;8.0;ml
dia-es;desayuno dulces y pan bolleria tartas y bizcochos;Bizcocho de azúcar 470 gr;2.29;4.87;g
mercadona-es;cuidado facial y corporal perfume y colonia;Lote hombre Misty Wood Esencia vital;4.8;4.8;ud
carrefour-es;el mercado verduras y hortalizas hortalizas;Calabaza cortada  500 g ;1.55;3.1;kg
mercadona-es;zumos naranja;Zumo pura naranja Hacendado;1.0;1.0;l
mercadona-es;cuidado del cabello coloracion cabello;Coloración permanente sin amoníaco Garnier 4.0 castaño;6.35;6.35;ud
carrefour-es;perfumeria e higiene cuidado y proteccion corporal limpieza facial;Toallitas Desmaquilladoras Suaves Piel seca/sensible Nivea 40 ud.;2.3;0.06;ud
carrefour-es;limpieza y hogar ambientadores absorbeolores;Ambientador absorbe olores para el frigorífico Croc Odor 1 ud.;2.4;2.4;ud
carrefour-es;limpieza y hogar papeleria boligrafos y correctores;Bolígrafo Tinta Borrable Frixion Ball Rojo;2.19;2.19;ud
carrefour-es;la despensa alimentacion legumbres;Alubia pinta El Peregrino 1 kg.;3.2;3.2;kg
carrefour-es;perfumeria e higiene higiene intima incontinencia;Compresas incontinencia maxi Carrefour 16 ud.;2.99;0.19;ud
carrefour-es;parafarmacia cuidado e higiene facial cremas faciales;Contorno de ojos Toleriane Ultra La Roche-Posay 20 ml.;18.0;18.0;ud
dia-es;alimentacion conservas dulces y mermeladas compotas;LA VIEJA FABRICA mermelada de melocoton frasco 350 gr;2.09;5.97;g
carrefour-es;la despensa aperitivos tortitas;Tortitas de maíz multicereales Carrefour sin gluten 130 g.;1.06;8.15;kg
dia-es;bebe panales de noche y aprendizaje;DRYNITES braguitas para niñas absorbentes de 8 a 15 años paquete 9 uds;9.99;1.11;ud
carrefour-es;perfumeria e higiene bano e higiene corporal esponjas manoplas y cepillos de bano;Manopla rizo Carrefour 2 ud.;1.1;0.55;ud
mercadona-es;bodega cerveza;Cerveza Pils Krombacher;12.0;2.4;l
dia-es;desayuno dulces y pan pan pan rallado;DR. SCHAR pan rallado SIN GLUTEN 300 gr;2.6;8.67;g
carrefour-es;la despensa dulce y desayuno galletas;Galletas con pepitas de chocolate Chips Ahoy 400 g.;3.47;8.67;kg
carrefour-es;la despensa conservas sopas y precocinados croquetas y rebozados;San Jacobos 360 g.;0.93;2.58;kg
carrefour-es;limpieza y hogar productos para bano wc;Discos wc activos inodoros aroma lima recambio Pato 2 ud.;4.49;2.24;ud
mercadona-es;carne hamburguesas y picadas;Burger de pavo y pollo;3.52;6.52;kg
carrefour-es;bebe perfumeria e higiene champu;Champú limpia y protege el cuero cabelludo con extracto natural de camomila y aloe vera Baby Natura 600 ml.;2.39;0.4;ml
carrefour-es;el mercado quesos todos los quesos;Queso rulo de cabra Carrefour 180 g;2.0;11.11;kg
carrefour-es;la despensa conservas sopas y precocinados caldos sopas y pure;Cado de carne 100% natural Knorr 6 pastillas;1.54;23.33;kg
carrefour-es;el mercado charcuteria foie pates y sobrasadas;Paté de olivada Carrefour sin gluten y sin lactosa 120 g.;1.35;11.25;kg
carrefour-es;parafarmacia cuidado corporal cuidado intimo;Gel higiene íntima protección Lactacyd 250 ml.;9.4;3.76;ml
carrefour-es;limpieza y hogar productos para toda la casa insecticidas;Insecticida Hogar y Plantas Carrefour 750 ml.;1.85;2.47;l
carrefour-es;la despensa conservas sopas y precocinados conservas de pescado y marisco;Zamburiñas es salsa de vieira Javimar 70 g.;3.05;43.57;kg
dia-es;perfumeria e higiene desodorante spray;SANEX desodorante dermo extra control spray 200 ml;3.09;15.45;ml
carrefour-es;perfumeria e higiene higiene intima toallitas y geles intimos;Gel íntimo con aloe Carefree 200 ml.;2.85;1.42;ml
carrefour-es;el mercado quesos todos los quesos;Queso gouda holland en lonchas Carrefour 200 g.;1.13;5.65;kg
dia-es;perfumeria e higiene cuidado manos jabon de manos liquido;MOUSSEL jabón líquido de manos higienizante dosificador 300 ml;1.99;6.63;ml
carrefour-es;limpieza y hogar bazar herramientas;Pintura plástica mate gris claro monocapa acrílico ecolabel Carrefour 750 ml.;7.9;10.53;l
carrefour-es;la despensa dulce y desayuno infusiones y tes;Té English Breakfast en bolsitas Twinings 25 ud.;3.19;63.8;kg
carrefour-es;la despensa conservas sopas y precocinados platos tradicionales;Fabada asturiana Carrefour 440 g.;1.04;2.36;kg
carrefour-es;bebidas aguas y zumos zumos no refrigerados;Zumo de naranja Don Simón exprimido con pulpa brik 1 l.;1.63;1.63;l
carrefour-es;perfumeria e higiene cosmetica rostro;Cuidado de noche anti-arrugas + firmeza Nivea Q10 Power 50 ml.;8.2;16.4;ml
carrefour-es;limpieza y hogar bazar automovil;Batería de Coche Varta Blue Dinamic F17 80Ah;160.0;160.0;ud
carrefour-es;bebidas refrescos isotonicas;Aquarius sabor naranja botella 1,5 l.;1.55;1.03;l
carrefour-es;el mercado charcuteria chorizo lomo y otros;Cecina de León moldeada La Encina 250 g aprox;5.02;33.45;kg
dia-es;alimentacion caldos sopas y pures sopas en sobre;DIA sopa jardinera sobre 85 grs;0.45;6.0;g
carrefour-es;bebidas vinos tinto;Coto Tinto 2016;5.5;5.5;ud
mercadona-es;bodega licores;Whisky escocés Brodick's;6.0;8.57;L
mercadona-es;congelados marisco;Mejillón de Chile cocido media concha Hacendado ultracongelado;2.85;7.92;kg
carrefour-es;la despensa alimentacion harinas y levaduras;Levadura Royal pack de 6 sobres de 16 g.;2.35;24.48;kg
carrefour-es;la despensa alimentacion aceites y vinagres;Vinagre de manzana Carrefour 1 l.;0.68;0.68;l
dia-es;lacteos y huevos leche leches especiales;DIA VITAL bebida de almendras envase 1 lt;1.45;1.45;ml
mercadona-es;cuidado facial y corporal manicura y pedicura;Laca de uñas alto brillo Deliplus 31 negro místico;2.5;22.73;ml
carrefour-es;parafarmacia bebe papillas y galletas;Papilla infantil desde 4 meses de arroz sin azúcar añadido Nestlé Nestum sin gluten y sin aceite de palma 250 g.;2.95;11.8;kg
mercadona-es;mascotas perro;Comida perro adulto Compy con pollo, cordero, verduras y arroz;6.5;1.63;kg
mercadona-es;cacao cafe e infusiones cafe soluble y otras bebidas;Crema de leche para café Campina;0.75;3.75;l
mercadona-es;cuidado facial y corporal depilacion;Bálsamo para depués de la depilación Deliplus;2.75;1.38;ml
carrefour-es;perfumeria e higiene depilacion y afeitado afeitado;Bálsamo suave para barba con manteca de cacao King C Gillette 100 ml.;10.45;10.45;ml
dia-es;frescos carne y aves adobados;Alitas de pollo adobadas sabor asado bandeja 450 gr;2.19;4.87;g
carrefour-es;limpieza y hogar cuidado de la ropa suavizantes;Suavizante concentrado orquídea y vainilla Carrefour 80 lavados.;1.75;0.02;ud
mercadona-es;aceite especias y salsas mayonesa ketchup y mostaza;Allioli Chovi;0.99;5.21;g
mercadona-es;bodega licores;Whiskey bourbon Black County;9.15;13.07;l
dia-es;alimentacion patatas fritas aperitivos y frutos secos aperitivos;MATUTANO fritos sabor barbacoa bolsa 49 gr;0.4;8.16;g
dia-es;lacteos y huevos horchatas horchatas;DANONE ACTIVIA bífidus natural edulcorado 0% M.G pack 4 unidades 120 gr;2.09;4.35;g
carrefour-es;la despensa dulce y desayuno chocolates turrones y bombones;Barritas de galleta crujiente cubiertas de chocolate con leche Nestlé Kit Kat 3 ud.;1.7;13.71;kg
carrefour-es;perfumeria e higiene bano e higiene corporal colonias;Agua de colonia Colors Rose Benetton 50 ml.;11.45;22.9;ml
carrefour-es;limpieza y hogar papeleria cartuchos de tinta;Cartucho de Tinta Kodak HP22 - Tricolor;16.99;16.99;ud
dia-es;charcuteria y quesos charcuteria y quesos al corte charcuteria cocida al corte;FRIAL pechuga de pavo natural en lonchas;13.89;13.89;g
dia-es;perfumeria e higiene cuidado del cabello tintes y coloracion;COLORSILK tinte Castaño Rojizo Claro Nº 55 caja 1 ud;3.25;3.25;ud
mercadona-es;marisco y pescado pescado congelado;Filetes de merluza al huevo Hacendado ultracongelados;3.95;6.58;kg
dia-es;perfumeria e higiene cuidado del cabello accesorios cabello;YATP cepillo desenredante 1 ud;7.05;7.05;ud
mercadona-es;cuidado facial y corporal perfume y colonia;Agua de colonia Heno de Pravia Original;2.85;0.32;ml
mercadona-es;maquillaje bases de maquillaje y corrector;Maquillaje mat mousse Maybelline 50 sun bronze;6.95;38.61;ml
carrefour-es;la despensa conservas sopas y precocinados conservas de pescado y marisco;Tacos de potón en salsa americana Carrefour sin gluten y sin lactosa pack de 3 unidades de 51 g.;1.45;6.2;kg
carrefour-es;el mercado charcuteria mortadela y chopped;Mortadela Di Bologna IGP Ferrarini España 100 g;2.3;23.0;kg
mercadona-es;carne cerdo;Solomillo de cerdo marinado con romero;6.09;8.7;kg
mercadona-es;carne hamburguesas y picadas;Preparado de carne picada vacuno;3.2;6.4;kg
carrefour-es;el mercado charcuteria jamon serrano e iberico pieza;Jamón cebo ibérico 50% raza ibérica Leyenda Ibérica pieza 7,5 Kg aprox;139.0;17.38;kg
mercadona-es;huevos leche y mantequilla leche y bebidas vegetales;Bebida láctea desnatada omega 3 Puleva;1.29;1.29;l
carrefour-es;el mercado verduras y hortalizas verduras y hortalizas congeladas;Perejil troceado Findus 50 g.;1.72;34.4;kg
dia-es;alimentacion pizza bases y masas bases y masas refrigeradas;BUITONI masa para empanada paquete 280 gr;2.99;10.68;g
dia-es;especial navidad dulces navidad surtidos navidenos;DIA DULCE NOEL turrón cacao almendra/crujiente surtido 20 gr;0.26;12.9;g
